id,asset_id,condition,description,model, manufacturer ,name,purchase_date,purchase_from,serial_no,status, supplier,warranty,value,user, created_at , updated_at
58cffb96-e49b-4e48-9882-2627f6955f6a,594-09-9971,BAD,"Nulla mollis molestie lorem. Quisque ut erat. Curabitur gravida nisi at nibh. In hac habitasse platea dictumst. Aliquam augue quam, sollicitudin vitae, consectetuer eget, rutrum at, lorem. Integer tincidunt ante vel ipsum. Praesent blandit lacinia erat. Vestibulum sed magna at nunc commodo placerat. Praesent blandit.",F150,Ford,Glass,11/26/2022,"Wisozk, Tillman and Davis",579497479-6,PENDING,Linktype,14,100,febdoe@kitehrms.com,12/20/2022,4/1/2023
,467-38-1659,BAD,,,Honda,Wood,7/29/2022,Schmeler Group,195945365-3,DENIED,Avaveo,4,83,aprildoe@kitehrms.com,,1/17/2023
039e5806-2272-4357-9a0a-d163f1dcfb45,770-52-5658,GOOD,"Proin eu mi. Nulla ac enim. In tempor, turpis nec euismod scelerisque, quam turpis adipiscing lorem, vitae mattis nibh ligula nec sem. Duis aliquam convallis nunc. Proin at turpis a pede posuere nonummy. Integer non velit. Donec diam neque, vestibulum eget, vulputate ut, ultrices vel, augue.",Mazda6,Mazda,Aluminum,8/15/2022,Casper-Terry,043459633-7,RETURNED,Yakijo,27,99,marchdoe@kitehrms.com,12/18/2022,2/25/2023
3e018306-f9e5-45af-8f90-1afc3ad1edd4,291-83-1342,EXCELLENT,"Donec odio justo, sollicitudin ut, suscipit a, feugiat et, eros. Vestibulum ac est lacinia nisi venenatis tristique. Fusce congue, diam id ornare imperdiet, sapien urna pretium nisl, ut volutpat sapien arcu sed augue. Aliquam erat volutpat. In congue. Etiam justo. Etiam pretium iaculis justo. In hac habitasse platea dictumst.",Ram Van 3500,Dodge,Granite,2/21/2023,Stokes-Borer,658773450-2,APPROVED,Aibox,14,67,aprildoe@kitehrms.com,4/22/2022,6/30/2022
5b73191a-ddb1-49ff-8d91-5cef3869f619,875-91-7081,BAD,Integer non velit.,Laser,Plymouth,Rubber,6/5/2022,Wiegand-McLaughlin,674932627-7,RETURNED,Wordify,11,62,junedoe@kitehrms.com,1/29/2023,9/30/2022
26c881b2-51c9-48e2-8317-46f6cdbd2b58,161-25-2921,BAD,"Cras non velit nec nisi vulputate nonummy. Maecenas tincidunt lacus at velit. Vivamus vel nulla eget eros elementum pellentesque. Quisque porta volutpat erat. Quisque erat eros, viverra eget, congue eget, semper rutrum, nulla. Nunc purus. Phasellus in felis.",Eurovan,Volkswagen,Wood,7/4/2022,Larkin-Hickle,916112518-0,DENIED,Tagcat,29,75,marchdoe@kitehrms.com,12/8/2022,3/31/2023
,232-79-7675,BAD,,,Subaru,Plastic,7/30/2022,"Morar, Ortiz and Ankunding",151520881-8,APPROVED,Vinder,14,99,marchdoe@kitehrms.com,,5/21/2022
,705-02-0019,EXCELLENT,,,Chrysler,Plastic,5/26/2022,"Oberbrunner, Mayer and Littel",758143071-5,RETURNED,Browsebug,4,72,jandoe@kitehrms.com,7/15/2022,9/11/2022
